{
  "schema_version": "2.0",
  "runtime_capability_preflight_id": "preflight-release-fixture-001",
  "plugin_version": "1.2.2",
  "workflow_run_id": "release-fixture-run-001",
  "created_at": "2026-07-10T01:00:01Z",
  "requested_alias": "evidence-audit-team",
  "selected_mode": "audit",
  "deliverable_type": "release-validator regression bundle",
  "selected_domain_pack": "generic-biomedical",
  "domain_pack_version": "0.1.0",
  "selection_reason": "The bounded validator claim has no specialty-domain assumptions.",
  "domain_specific_assumptions": [],
  "workflow_tier": "full",
  "requested_omics_track": "not-applicable",
  "domain_specific_failure_modes_loaded": true,
  "domain_assumptions_skipped": [],
  "results_integration_required": true,
  "evidence_scope": {
    "source_types": [
      "local-file"
    ],
    "species_or_model": "not-applicable",
    "date_or_version_needs": "immutable bundled snapshot dated 2026-07-10"
  },
  "risk_class": "low",
  "required_role_outputs": [
    "citation-verifier",
    "post-write-final-validator"
  ],
  "skipped_role_outputs_with_reason": [],
  "external_tools_allowed": {
    "allowed": true,
    "limits": "Local deterministic validators and bundled public-safe fixture content only."
  },
  "file_write_plan": {
    "will_write_files": true,
    "allowed_paths": [
      "tests/fixtures/valid_full_protocol_bundle"
    ]
  },
  "stop_criteria": [
    "Any receipt, identity, support, or bundle-integrity error blocks release."
  ],
  "checkpoint_plan": [
    {
      "checkpoint": "source and receipt lock",
      "required_before": "final wording"
    }
  ],
  "execution_strategy": "inline_first_selective_review",
  "spawned_review_plan": {
    "allowed": true,
    "budget": 1,
    "selected_roles": [
      "citation-verifier"
    ],
    "rationale": "One deterministic external validation lane is sufficient for the bounded regression claim."
  },
  "team_spawn_plan": {
    "allowed": false,
    "budget": 0,
    "selected_teams": [],
    "dependency_graph": [],
    "nested_spawn_allowed": false,
    "rationale": "No multi-team reasoning is required for a single bounded validator invariant."
  },
  "all_role_spawn_avoidance_reason": "Only the claim-level validation role is material to this regression bundle.",
  "nested_spawn_policy": {
    "allowed": false,
    "authorization": "not requested",
    "limits": "Nested spawning is disabled."
  },
  "post_team_audit_plan": "Verify receipt hashes, claim linkage, final wording, and bundle integrity.",
  "source_corpus_id": "corpus-release-fixture-001"
}
